<?xml version="1.0"?>
<!DOCTYPE CATALOG SYSTEM "cd_catalog.dtd">
<CATALOG>
  <CD>
	  <TITLE>The Dark Side of the Moon</TITLE>
	  <ARTIST>Pink Floyd</ARTIST>
	  <COUNTRY>USA</COUNTRY>
	  <COMPANY>Capital Records</COMPANY>
	  <PRICE>12.99</PRICE>
	  <COST>5.99</COST>
	  <YEAR>1973</YEAR>
	  <INVENTORY>3</INVENTORY>
  </CD>
  <CD>
	  <TITLE>Houses of the Holy</TITLE>
	  <ARTIST>Led Zeppelin</ARTIST>
	  <COUNTRY>USA</COUNTRY>
	  <COMPANY>Atlantic Records</COMPANY>
	  <COST>5.99</COST>
	  <YEAR>1973</YEAR>
	  <BIN>1A3C</BIN>
  </CD>
  <CD>
	  <TITLE>Beggars Banquet</TITLE>
	  <ARTIST>Rolling Stones</ARTIST>
	  <COUNTRY>USA</COUNTRY>
	  <COMPANY>Decca Records</COMPANY>
	  <PRICE>11.99</PRICE>
	  <COST>5.99</COST>
	  <YEAR>1968</YEAR>
  </CD>
 </CATALOG>